{
  "$schema": "./service-catalog.schema.json",
  "schemaVersion": 2,
  "sprint": "F001",
  "status": "ownership-baseline-not-runtime-acceptance",
  "operatingModel": "company-managed teams is an explicit initial assumption, not a confirmed user decision",
  "publicIngress": "api-gateway",
  "services": [
    {
      "id": "identity",
      "path": "services/identity",
      "packageName": "@carwash/identity",
      "owner": "domain:identity",
      "reviewer": "baraabd",
      "purpose": "Accounts, authentication, sessions and permission grants",
      "responsibilities": [
        "Accounts, authentication, sessions and permission grants",
        "Own local data, migrations, authorization and release artifact",
        "Expose only versioned APIs and events; never cross-service implementation or DB access"
      ],
      "database": "cw_identity",
      "runtimeRole": "cw_identity_app",
      "migrationRole": "cw_identity_migrate",
      "dataStatus": "reserved-not-provisioned-by-F001",
      "owns": ["users", "credentials", "sessions", "roles", "permissions"],
      "api": {
        "version": 1,
        "prefix": "/internal/v1/identity",
        "status": "planned-not-implemented",
        "contractPackage": "@carwash/contracts"
      },
      "events": {
        "version": 1,
        "published": ["identity.user-updated.v1", "identity.access-revoked.v1"],
        "status": "planned-not-implemented",
        "contractPackage": "@carwash/event-contracts"
      },
      "forbiddenDependencies": [
        "@carwash/api-gateway",
        "@carwash/billing",
        "@carwash/booking",
        "@carwash/catalog",
        "@carwash/communications",
        "@carwash/configuration",
        "@carwash/customer",
        "@carwash/dispatch",
        "@carwash/geo",
        "@carwash/media",
        "@carwash/pricing",
        "@carwash/reporting",
        "@carwash/reviews",
        "@carwash/scheduling",
        "@carwash/subscription",
        "@carwash/support",
        "@carwash/vehicle",
        "@carwash/wallet",
        "@carwash/workforce"
      ],
      "deployment": {
        "artifact": "carwash-identity",
        "independent": true,
        "verified": false
      },
      "runtimeImplementation": "implemented-capability-runtime",
      "acceptedCapabilities": ["identity-security-v1"]
    },
    {
      "id": "customer",
      "path": "services/customer",
      "packageName": "@carwash/customer",
      "owner": "domain:customer",
      "reviewer": "baraabd",
      "purpose": "Customer profiles, owned addresses, preferences and consent",
      "responsibilities": [
        "Customer profiles, owned addresses, preferences and consent",
        "Own local data, migrations, authorization and release artifact",
        "Expose only versioned APIs and events; never cross-service implementation or DB access"
      ],
      "database": "cw_customer",
      "runtimeRole": "cw_customer_app",
      "migrationRole": "cw_customer_migrate",
      "dataStatus": "reserved-not-provisioned-by-F001",
      "owns": ["customers", "addresses", "preferences", "customer_consents"],
      "api": {
        "version": 1,
        "prefix": "/internal/v1/customer",
        "status": "planned-not-implemented",
        "contractPackage": "@carwash/contracts"
      },
      "events": {
        "version": 1,
        "published": ["customer.profile-updated.v1"],
        "status": "planned-not-implemented",
        "contractPackage": "@carwash/event-contracts"
      },
      "forbiddenDependencies": [
        "@carwash/api-gateway",
        "@carwash/billing",
        "@carwash/booking",
        "@carwash/catalog",
        "@carwash/communications",
        "@carwash/configuration",
        "@carwash/dispatch",
        "@carwash/geo",
        "@carwash/identity",
        "@carwash/media",
        "@carwash/pricing",
        "@carwash/reporting",
        "@carwash/reviews",
        "@carwash/scheduling",
        "@carwash/subscription",
        "@carwash/support",
        "@carwash/vehicle",
        "@carwash/wallet",
        "@carwash/workforce"
      ],
      "deployment": {
        "artifact": "carwash-customer",
        "independent": true,
        "verified": false
      },
      "runtimeImplementation": "existing-health-only-shell"
    },
    {
      "id": "vehicle",
      "path": "services/vehicle",
      "packageName": "@carwash/vehicle",
      "owner": "domain:vehicle",
      "reviewer": "baraabd",
      "purpose": "Vehicles, plate metadata and customer-vehicle ownership",
      "responsibilities": [
        "Vehicles, plate metadata and customer-vehicle ownership",
        "Own local data, migrations, authorization and release artifact",
        "Expose only versioned APIs and events; never cross-service implementation or DB access"
      ],
      "database": "cw_vehicle",
      "runtimeRole": "cw_vehicle_app",
      "migrationRole": "cw_vehicle_migrate",
      "dataStatus": "reserved-not-provisioned-by-F001",
      "owns": ["vehicles", "vehicle_ownerships"],
      "api": {
        "version": 1,
        "prefix": "/internal/v1/vehicle",
        "status": "planned-not-implemented",
        "contractPackage": "@carwash/contracts"
      },
      "events": {
        "version": 1,
        "published": ["vehicle.vehicle-updated.v1"],
        "status": "planned-not-implemented",
        "contractPackage": "@carwash/event-contracts"
      },
      "forbiddenDependencies": [
        "@carwash/api-gateway",
        "@carwash/billing",
        "@carwash/booking",
        "@carwash/catalog",
        "@carwash/communications",
        "@carwash/configuration",
        "@carwash/customer",
        "@carwash/dispatch",
        "@carwash/geo",
        "@carwash/identity",
        "@carwash/media",
        "@carwash/pricing",
        "@carwash/reporting",
        "@carwash/reviews",
        "@carwash/scheduling",
        "@carwash/subscription",
        "@carwash/support",
        "@carwash/wallet",
        "@carwash/workforce"
      ],
      "deployment": {
        "artifact": "carwash-vehicle",
        "independent": true,
        "verified": false
      },
      "runtimeImplementation": "onboarded-foundation-runtime"
    },
    {
      "id": "catalog",
      "path": "services/catalog",
      "packageName": "@carwash/catalog",
      "owner": "domain:catalog",
      "reviewer": "baraabd",
      "purpose": "Wash definitions, add-ons, durations and compatibility; never monetary quotes",
      "responsibilities": [
        "Wash definitions, add-ons, durations and compatibility; never monetary quotes",
        "Own local data, migrations, authorization and release artifact",
        "Expose only versioned APIs and events; never cross-service implementation or DB access"
      ],
      "database": "cw_catalog",
      "runtimeRole": "cw_catalog_app",
      "migrationRole": "cw_catalog_migrate",
      "dataStatus": "reserved-not-provisioned-by-F001",
      "owns": ["packages", "addons", "service_compatibilities"],
      "api": {
        "version": 1,
        "prefix": "/internal/v1/catalog",
        "status": "planned-not-implemented",
        "contractPackage": "@carwash/contracts"
      },
      "events": {
        "version": 1,
        "published": ["catalog.package-updated.v1"],
        "status": "planned-not-implemented",
        "contractPackage": "@carwash/event-contracts"
      },
      "forbiddenDependencies": [
        "@carwash/api-gateway",
        "@carwash/billing",
        "@carwash/booking",
        "@carwash/communications",
        "@carwash/configuration",
        "@carwash/customer",
        "@carwash/dispatch",
        "@carwash/geo",
        "@carwash/identity",
        "@carwash/media",
        "@carwash/pricing",
        "@carwash/reporting",
        "@carwash/reviews",
        "@carwash/scheduling",
        "@carwash/subscription",
        "@carwash/support",
        "@carwash/vehicle",
        "@carwash/wallet",
        "@carwash/workforce"
      ],
      "deployment": {
        "artifact": "carwash-catalog",
        "independent": true,
        "verified": false
      },
      "runtimeImplementation": "existing-health-only-shell"
    },
    {
      "id": "pricing",
      "path": "services/pricing",
      "packageName": "@carwash/pricing",
      "owner": "domain:pricing",
      "reviewer": "baraabd",
      "purpose": "Versioned prices, promotions and expiring server-issued quotes",
      "responsibilities": [
        "Versioned prices, promotions and expiring server-issued quotes",
        "Own local data, migrations, authorization and release artifact",
        "Expose only versioned APIs and events; never cross-service implementation or DB access"
      ],
      "database": "cw_pricing",
      "runtimeRole": "cw_pricing_app",
      "migrationRole": "cw_pricing_migrate",
      "dataStatus": "reserved-not-provisioned-by-F001",
      "owns": ["price_versions", "quotes", "promotions"],
      "api": {
        "version": 1,
        "prefix": "/internal/v1/pricing",
        "status": "planned-not-implemented",
        "contractPackage": "@carwash/contracts"
      },
      "events": {
        "version": 1,
        "published": ["pricing.quote-issued.v1", "pricing.price-published.v1"],
        "status": "planned-not-implemented",
        "contractPackage": "@carwash/event-contracts"
      },
      "forbiddenDependencies": [
        "@carwash/api-gateway",
        "@carwash/billing",
        "@carwash/booking",
        "@carwash/catalog",
        "@carwash/communications",
        "@carwash/configuration",
        "@carwash/customer",
        "@carwash/dispatch",
        "@carwash/geo",
        "@carwash/identity",
        "@carwash/media",
        "@carwash/reporting",
        "@carwash/reviews",
        "@carwash/scheduling",
        "@carwash/subscription",
        "@carwash/support",
        "@carwash/vehicle",
        "@carwash/wallet",
        "@carwash/workforce"
      ],
      "deployment": {